{
  "type": "object",
  "properties": {
    "id": {
      "type": "string"
    },
    "type": {
      "type": "string",
      "enum": [
        "project",
        "module"
      ]
    },
    "name": {
      "type": "string"
    },
    "dependencies": {
      "type": "object",
      "additionalProperties": {
        "type": "string"
      }
    },
    "services": {
      "type": "object",
      "properties": {
        "start": {
          "type": "string"
        },
        "stop": {
          "type": "string"
        },
        "readyCheck": {
          "type": "string"
        },
        "startupTimeoutMs": {
          "type": "number"
        },
        "port": {
          "type": "string"
        }
      },
      "additionalProperties": false
    },
    "start": {
      "type": "string"
    },
    "startupTimeoutMs": {
      "type": "number"
    },
    "readyMessage": {
      "type": "string"
    },
    "end": {
      "type": "string"
    },
    "port": {
      "type": "string"
    },
    "backend": {
      "type": "object",
      "properties": {
        "defaultEnvProperties": {
          "type": "object",
          "additionalProperties": {
            "type": "string"
          }
        }
      },
      "additionalProperties": false
    },
    "frontend": {
      "type": "object",
      "properties": {
        "srcDir": {
          "type": "string",
          "default": "frontend/src"
        },
        "routesDir": {
          "type": "string"
        },
        "routePrefix": {
          "type": "string"
        },
        "defaultEnvProperties": {
          "type": "object",
          "additionalProperties": {
            "type": "string"
          }
        }
      },
      "additionalProperties": false,
      "default": {
        "alias": "@/*",
        "srcDir": "frontend/src"
      }
    },
    "dockerComposeFile": {
      "type": "string"
    }
  },
  "required": [
    "type",
    "name"
  ],
  "additionalProperties": false,
  "$schema": "http://json-schema.org/draft-07/schema#"
}